{"$schema":"https://json-schema.org/draft/2020-12/schema","$id":"https://recrafts.local/contracts/correction.schema.json","type":"object","additionalProperties":false,"required":["correction_id","base_package_id","actor","actor_role","created_at","reason","operations","decision_context"],"properties":{"correction_id":{"type":"string","minLength":1},"base_package_id":{"type":"string","pattern":"^package-"},"actor":{"type":"string","minLength":1},"actor_role":{"enum":["project-owner","authorized-reviewer"]},"created_at":{"type":"string","minLength":1},"reason":{"type":"string","minLength":1},"operations":{"type":"array","minItems":1,"items":{"type":"object","additionalProperties":false,"required":["operation_id","type","target_id","before","after","evidence_refs","claim_refs","reason"],"properties":{"operation_id":{"type":"string","minLength":1},"type":{"enum":["replace-token","reject-token","replace-component","reject-component","replace-grid-rule","reject-grid-rule","reclassify-region","resolve-conflict","confirm-candidate","reject-candidate","finalize-accepted-metadata"]},"target_id":{"type":"string","minLength":1},"before":{},"after":{},"evidence_refs":{"type":"array","minItems":1,"uniqueItems":true,"items":{"type":"string"}},"claim_refs":{"type":"array","minItems":1,"uniqueItems":true,"items":{"type":"string"}},"reason":{"type":"string","minLength":1}}}},"decision_context":{"type":"object"}}}
