{
  "correction_id": "correction-r010-owner-pass-20260716",
  "base_package_id": "package-91d1a8226792e35e",
  "actor": "Nick",
  "actor_role": "project-owner",
  "created_at": "2026-07-16T12:00:00+08:00",
  "reason": "项目所有者已明确确认八项审阅内容并给出 R-010 PASS。",
  "operations": [
    {
      "operation_id": "resolve-owner-review-conflict",
      "type": "resolve-conflict",
      "target_id": "conflict-owner-core-theme-review",
      "before": {
        "status": "open"
      },
      "after": {
        "status": "resolved",
        "verdict": "confirmed"
      },
      "evidence_refs": [
        "ev-together-desktop-viewport",
        "ev-spade-desktop-viewport"
      ],
      "claim_refs": [
        "claim-shell-brand-separation",
        "claim-density-rhythm"
      ],
      "reason": "项目所有者确认来源分层、Core Grammar、主题、组件、拓扑、法律与可访问性限制及预览覆盖。"
    }
  ],
  "decision_context": {
    "owner_message": "八项全部确认，R-010 PASS，后续取消这个所有者评审环节。",
    "review_scope": "R-010 eight-item owner review",
    "workflow_note": "本次以项目所有者明确消息替代额外评审表；Runtime 的人类授权安全门禁保持不变。"
  }
}
